{
  "$schema": "https://json-schema.org/draft/2020-12/schema",
  "$id": "https://github.com/egohygiene/aniflow/docs/contracts/machine-envelope-v1.schema.json",
  "title": "aniflow machine envelope v1",
  "type": "object",
  "required": [
    "schema_version",
    "command",
    "status"
  ],
  "properties": {
    "schema_version": {
      "const": 1
    },
    "command": {
      "enum": [
        "doctor",
        "toolchain_doctor",
        "toolchain_plan",
        "toolchain_probe",
        "toolchain_prepare_registration",
        "toolchain_prepare_media",
        "inspect",
        "temporal_inspect",
        "audio_plan",
        "audio_inspect",
        "audio_analyze",
        "audio_resume",
        "audio_transcribe",
        "audio_transcript_export",
        "audio_lyrics_align",
        "audio_lyrics_export",
        "audio_midi_extract",
        "audio_midi_export",
        "video_interpolation_plan",
        "video_frame_selection_plan",
        "video_import_frames",
        "video_repair_frames",
        "video_upscale_frames",
        "timed_text_formats",
        "timed_text_convert",
        "plan",
        "plan_v3",
        "run",
        "run_v3",
        "resume",
        "resume_v3",
        "status",
        "status_v3",
        "segment_plan",
        "segment_run",
        "segment_resume",
        "segment_reconstruct",
        "cache_inspect",
        "cache_invalidate",
        "cache_prune"
      ]
    },
    "status": {
      "enum": [
        "success",
        "error"
      ]
    },
    "result": true,
    "error": {
      "type": "object",
      "required": [
        "category",
        "message"
      ],
      "properties": {
        "category": {
          "enum": [
            "input",
            "configuration",
            "dependency",
            "media",
            "execution",
            "state",
            "io",
            "internal"
          ]
        },
        "message": {
          "type": "string",
          "minLength": 1
        },
        "temporal": {
          "$ref": "#/$defs/diagnostic"
        },
        "validation": {
          "$ref": "validation-diagnostic-v1.schema.json"
        },
        "cache": {
          "$ref": "cache-diagnostic-v1.schema.json"
        }
      },
      "additionalProperties": false
    }
  },
  "oneOf": [
    {
      "properties": {
        "status": {
          "const": "success"
        }
      },
      "required": [
        "result"
      ],
      "not": {
        "required": [
          "error"
        ]
      }
    },
    {
      "properties": {
        "status": {
          "const": "error"
        }
      },
      "required": [
        "error"
      ]
    }
  ],
  "additionalProperties": false,
  "$defs": {
    "diagnostic": {
      "type": "object",
      "additionalProperties": false,
      "required": [
        "code",
        "stream_index",
        "message"
      ],
      "properties": {
        "code": {
          "enum": [
            "invalid_rational",
            "arithmetic_overflow",
            "malformed_probe",
            "duplicate_stream",
            "missing_video",
            "ambiguous_video",
            "ambiguous_audio",
            "invalid_selection",
            "unacknowledged_stream",
            "missing_timestamp",
            "invalid_duration",
            "presentation_order",
            "decode_order",
            "missing_temporal_evidence",
            "variable_frame_rate",
            "nonzero_presentation_offset",
            "negative_presentation_offset",
            "stream_duration_mismatch",
            "synchronization_mismatch",
            "frame_count_mismatch",
            "timeline_mismatch",
            "unsupported_stream",
            "probe_limit",
            "source_changed",
            "legacy_temporal_evidence"
          ]
        },
        "stream_index": {
          "anyOf": [
            {
              "type": "integer",
              "minimum": 0,
              "maximum": 4294967295
            },
            {
              "type": "null"
            }
          ]
        },
        "message": {
          "type": "string",
          "minLength": 1
        }
      }
    }
  }
}
